{
  "$schema": "./release-readiness.schema.json",
  "schema_version": "1.0",
  "assessed_at": "2026-10-25",
  "package_version": "0.3.1.dev1",
  "manifest_api": "0.3",
  "decision": "no-go",
  "publication_authorized": false,
  "inventory": {
    "distributions": 36,
    "registrations": 39,
    "activation_intent": 24,
    "inspect_only": 15
  },
  "gates": [
    {
      "id": "core-quality",
      "title": "Python 3.10/3.12 tests, typing, lint, and clean wheel",
      "required": true,
      "status": "passed",
      "evidence": [
        ".github/workflows/ci.yml"
      ]
    },
    {
      "id": "ecosystem-composition",
      "title": "Organization-wide Manifest 0.3 composition audit",
      "required": true,
      "status": "passed",
      "evidence": [
        "docs/support-matrix.md"
      ]
    },
    {
      "id": "real-plugin-lifecycle",
      "title": "Clean-wheel plugin activation and reversible lifecycle",
      "required": true,
      "status": "passed",
      "evidence": [
        "docs/kv-materialization-runbook.md",
        "docs/support-matrix.md"
      ]
    },
    {
      "id": "process-owned-runtime-evidence",
      "title": "Runtime-effective state comes from a live owning process",
      "required": true,
      "status": "passed",
      "evidence": [
        "docs/design/host-plugin-evidence-0.1.md",
        "docs/support-matrix.md"
      ]
    },
    {
      "id": "stable-schema",
      "title": "Manifest schema and compatibility policy are frozen",
      "required": true,
      "status": "passed",
      "evidence": [
        "docs/manifest-0.3.md",
        "spec/manifest-0.3/manifest.schema.json",
        "spec/manifest-0.3/conformance-vectors.json",
        "spec/manifest-0.3/migration-vectors.json"
      ]
    },
    {
      "id": "native-current-host-npu",
      "title": "Current native host and NPU lifecycle qualification",
      "required": true,
      "status": "passed",
      "evidence": [
        "docs/support-matrix.md",
        "docs/evidence/native-current-npu-qualification-2026-10-11.md"
      ]
    },
    {
      "id": "failure-and-permission-matrix",
      "title": "Failure degradation and permission denial are repeatable",
      "required": true,
      "status": "passed",
      "evidence": [
        "docs/failure-permission-matrix.json",
        "docs/design/failure-semantics.md",
        "tests/test_failure_permission_matrix.py"
      ]
    },
    {
      "id": "upstream-host-contract",
      "title": "Host contract has completed the required upstream review",
      "required": true,
      "status": "passed",
      "evidence": [
        "docs/evidence/host-contract-maintainer-acceptance-2026-10-10.md",
        "docs/acceptance-gates.md",
        "docs/support-matrix.md"
      ]
    },
    {
      "id": "performance-and-support-claims",
      "title": "Performance evidence and support claims are bounded and complete",
      "required": true,
      "status": "passed",
      "evidence": [
        "docs/qualification-policy.md",
        "docs/evaluation-plan.md",
        "docs/support-matrix.md",
        "src/vllm_hust_ext/catalog.py",
        "tests/test_catalog.py"
      ]
    },
    {
      "id": "scheduler-carrier-qualification",
      "title": "New scheduler class carrier and paired MOD qualification",
      "required": true,
      "status": "blocked",
      "evidence": [
        "docs/scheduler-class-carrier.md"
      ],
      "remaining_action": "Review and qualify the new installed carrier and its owning-process observations against pinned hosts; this development build is not an authorized stable release."
    }
  ]
}
